ID,title,images,price,stock,currency
1005004167443688,Darlingaga Y2K Rüschen Spitze Trim Strap Mesh Top Leibchen Retro Mode Sexy Sommer Crop Tops Weibliche Sehen Durch Ästhetischen Kleidung,https://ae01.alicdn.com/kf/S7f3cb5fd87a0401c8361eb1e6438761co/Darlingaga-Y2K-R-schen-Spitze-Trim-Strap-Mesh-Top-Leibchen-Retro-Mode-Sexy-Sommer-Crop-Tops.jpg,24.39,2881,EUR
1005004840460701,Hip Hop Strick männer frauen Pullover 2022 Harajuku Mode Spinne Junge Muster Druck Lose Tops Casual Streetwear Pullover,https://ae01.alicdn.com/kf/S5487f2de924747c8926ef6c6f67db69eJ/Hip-Hop-Strick-m-nner-frauen-Pullover-2022-Harajuku-Mode-Spinne-Junge-Muster-Druck-Lose-Tops.jpg,38.19,11161,
1005004198821997,Retro Zipper Crop Tops Frauen Kurze Gestrickt Leibchen Ärmellose Freizeit Tank Top Camis Sommer 2022 Neue,https://ae01.alicdn.com/kf/Se625f8a4636046b99288f6ee70f57726N/Retro-Zipper-Crop-Tops-Frauen-Kurze-Gestrickt-Leibchen-rmellose-Freizeit-Tank-Top-Camis-Sommer-2022-Neue.jpg,7.39,7361
1005005755483118,Singreiny Polka Dot Falten kurze Bluse Sommer Slash Neck Langarm Frauen Krawatte Halfter elastische Taille Mode Französisch Beach Top,https://ae01.alicdn.com/kf/Sadcf40d530f240729959edb46316eff7z/Singreiny-Polka-Dot-Falten-kurze-Bluse-Sommer-Slash-Neck-Langarm-Frauen-Krawatte-Halfter-elastische-Taille-Mode.jpg,20.27,591
1005004666114716,Mode Kuromi kurz geschnittenes Top lustige Cartoon T-Shirt Frauen Manga T-Shirt y2k Grafik T-Shirt Streetwear Crop Top T-Shirts weibliche 90er Jahre,https://ae01.alicdn.com/kf/Sd1e416de909b42f6917186b924efb035Q/Mode-Kuromi-kurz-geschnittenes-Top-lustige-Cartoon-T-Shirt-Frauen-Manga-T-Shirt-y2k-Grafik-T.jpg,10.43,41995
1005006068768874,Winter warm halten Frauen mit Samt Thermo Weste Damen schlanke Korsett O-Ausschnitt ärmellose weibliche sexy Tops Damen Camis Unterwäsche,https://ae01.alicdn.com/kf/Sebfcaa385a9243ee9ba8238ca99698aa2/Winter-warm-halten-Frauen-mit-Samt-Thermo-Weste-Damen-schlanke-Korsett-O-Ausschnitt-rmellose-weibliche-sexy.jpg,9.46,64
1005006353903608,O Hals Sommer Strickweste ärmellose Frauen sexy Basic T-Shirt weiß schulter frei gerippt schwarz Tanktops lässig,https://ae01.alicdn.com/kf/S4638fc3d5b1d4ebf95749240d0fe57d4m/O-Hals-Sommer-Strickweste-rmellose-Frauen-sexy-Basic-T-Shirt-wei-schulter-frei-gerippt-schwarz-Tanktops.jpg,6.73,1757
1005004769873976,2022 lose Frauen Dünne Strickjacke Pullover Baumwolle Mode Tops Langarm Öffnen Stich Mäntel Pullover Weibliche Casual Femme Herbst,https://ae01.alicdn.com/kf/S36cd07c0e30844f88a0e64e05ebe5f829/2022-lose-Frauen-D-nne-Strickjacke-Pullover-Baumwolle-Mode-Tops-Langarm-ffnen-Stich-M-ntel-Pullover.jpg,7.33,39852
1005004777993462,Atmungsaktive sexy nahtlose Top Frauen Sport-BH hohe Wirkung für Fitness Fitness Yoga Sportswear Push-up-BH,https://ae01.alicdn.com/kf/S505a831c0dab400fa079f89c43b9599er/Atmungsaktive-sexy-nahtlose-Top-Frauen-Sport-BH-hohe-Wirkung-f-r-Fitness-Fitness-Yoga-Sportswear-Push.jpg,3.92,1152
1005006344428400,Julissa Mo Langarm gestrickt Einreiher Knöpfe Strickjacke Pullover Frauen Crew dünn vielseitig gerippt Wolle unten oben,https://ae01.alicdn.com/kf/Sf6e67dbe6ee345fa9ec20e1117e723deN/Julissa-Mo-Langarm-gestrickt-Einreiher-Kn-pfe-Strickjacke-Pullover-Frauen-Crew-d-nn-vielseitig-gerippt-Wolle.jpg,29.0,23981
1005004883397735,"Mit EINEM Körper Wie Diese, Die Bedürfnisse Haar Shirt Kahl Geschenk Freizeit T Shirts Für Männer Tops T Shirt Im Freien neue Lustige Tuch geschenk",https://ae01.alicdn.com/kf/S1824accde5134899972e3ee6e1d002ea8/Mit-EINEM-K-rper-Wie-Diese-Die-Bed-rfnisse-Haar-Shirt-Kahl-Geschenk-Freizeit-T-Shirts.jpg,11.42,49692
1005006148969478,Komi san kann nicht Kommunikation muster Damen Hoodie bequeme Harajuku Tops Tasche Raglan Sweatshirt Mode All-Match Hoodie,https://ae01.alicdn.com/kf/Sbdcf70655c3f41a89a702bcdb8af2012B/Komi-san-kann-nicht-Kommunikation-muster-Damen-Hoodie-bequeme-Harajuku-Tops-Tasche-Raglan-Sweatshirt-Mode-All.jpg,23.02,19999
1005005219383594,Mode Frauen Dame Casual Tops Rohr Brust Wrap Bandeau Unterwäsche Schwarz Weiß Gewickelt Brustgurt Brust Pad Unterwäsche,https://ae01.alicdn.com/kf/H21f62f922e764619b6f6f51521d76fdd1/Mode-Frauen-Dame-Casual-Tops-Rohr-Brust-Wrap-Bandeau-Unterw-sche-Schwarz-Wei-Gewickelt-Brustgurt-Brust.jpg,8.03,96
1005005729692956,Frauen drucken ärmellose Crop Top Tanktops sexy Weste Buchstaben y2k solide kurze Frauen T-Shirt Leibchen Crop Top mit BH-Pad,https://ae01.alicdn.com/kf/S1903f651abf94f318e148d90a6e28dfcy/Frauen-drucken-rmellose-Crop-Top-Tanktops-sexy-Weste-Buchstaben-y2k-solide-kurze-Frauen-T-Shirt-Leibchen.jpg,7.3,3530
4000725701809,Winter Frühling Nische Design Harajuku bf lose Frauen Pullover Pullover Langarm Cartoon Hunde Farb block Y2k Strickwaren Tops,https://ae01.alicdn.com/kf/Sd5506f802be4444a80223106e87b6ed3O/Winter-Fr-hling-Nische-Design-Harajuku-bf-lose-Frauen-Pullover-Pullover-Langarm-Cartoon-Hunde-Farb-block.jpg,39.44,47
1005005833682308,Y2k Brief Grafiken Baby T-Shirt Vintage Mädchen Ernte Tops schlanke 1920er Jahre Fee Grunge ästhetische Harajuku Kurzarm T-Shirt Sommer,https://ae01.alicdn.com/kf/S650d27e4b9134f59bbe41dc3ae390890q/Y2k-Brief-Grafiken-Baby-T-Shirt-Vintage-M-dchen-Ernte-Tops-schlanke-1920er-Jahre-Fee-Grunge.jpg,14.64,3832
1005004230487129,Sommer Sexy Tanks Und Camisoles Crop Top Frauen Ärmelloses T-Shirt Dünne Dame Bralette Strap Camis Dünne Weste,https://ae01.alicdn.com/kf/Se5edb6d976fc48b2beea5e200d18cd7ec/Sommer-Sexy-Tanks-Und-Camisoles-Crop-Top-Frauen-rmelloses-T-Shirt-D-nne-Dame-Bralette-Strap.jpg,2.07,34380
1005006046453537,H. sa Frauen Winter pullover Pullover Strick pullover lose gestreifte Pull Jumper lässig Top Argyle Pullover Trikots Mujer Invierno,https://ae01.alicdn.com/kf/Sa06accee25d646b2bb8e9965a6c33f70O/H-sa-Frauen-Winter-pullover-Pullover-Strick-pullover-lose-gestreifte-Pull-Jumper-l-ssig-Top-Argyle.png,28.75,116
4000393751053,2020 neue Damen Langarm Sweatshirts Crop Tops Frühling Herbst solide lässig lose Pullover Damen hemden Camisetas,https://ae01.alicdn.com/kf/H64c43856a6c84e3cba3f138a4f76e0ddU/2020-neue-Damen-Langarm-Sweatshirts-Crop-Tops-Fr-hling-Herbst-solide-l-ssig-lose-Pullover-Damen.jpg,8.5,15360
4001233305979,S-5XL Sport Top Yoga Bh Frauen Push-Up Unterwäsche BH Gym Shirt Fitness Atmungsaktiv Sportswear Sport Bh Crop Tank Top plus Größe,https://ae01.alicdn.com/kf/H1ba476f267194630b660f9424188b620n/S-5XL-Sport-Top-Yoga-Bh-Frauen-Push-Up-Unterw-sche-BH-Gym-Shirt-Fitness-Atmungsaktiv.jpg,22.97,200773
1005006007554314,Goth Punk gestreiften Knopf Cami Top Frauen Sommer y2k Kleidung Grunge High Street ärmellose Spaghetti träger Crop Top Streetwear,https://ae01.alicdn.com/kf/S25063fce3b52466e84ad6eb9b7c5d82bj/Goth-Punk-gestreiften-Knopf-Cami-Top-Frauen-Sommer-y2k-Kleidung-Grunge-High-Street-rmellose-Spaghetti-tr.jpg,10.36,102
1005004671493288,Frauen Französisch Druck Leibchen Draht frei Dessous sexy Mode Leibchen Unterwäsche ärmellose Spitze Bra lette Top weibliche Spitze Tops,https://ae01.alicdn.com/kf/S65e768167ffa433490847443b043708eS/Frauen-Franz-sisch-Druck-Leibchen-Draht-frei-Dessous-sexy-Mode-Leibchen-Unterw-sche-rmellose-Spitze-Bra.jpg,6.32,150
1005004909035907,Deeptown Y2K Rosa Gestreiften Pullover Frauen Harajuku Vintage Schwarze Gestrickte Jumper Grunge Sexy Loch Aushöhlen Lose Alle-spiel tops,https://ae01.alicdn.com/kf/S8b47e6b5fe204c948a2e2e98fe4165bea/Deeptown-Y2K-Rosa-Gestreiften-Pullover-Frauen-Harajuku-Vintage-Schwarze-Gestrickte-Jumper-Grunge-Sexy-Loch-Aush-hlen.jpg,32.19,9888
1005004662460610,Sexy Kreuz Zurück Straps Sport Bh Stoßfest Atmungs Fitness Lauf Gym Sport Weste Top Sport Bh Sportswear für Frauen Mädchen,https://ae01.alicdn.com/kf/S2cefb4a3fcf04a3a92bce825faabac30l/Sexy-Kreuz-Zur-ck-Straps-Sport-Bh-Sto-fest-Atmungs-Fitness-Lauf-Gym-Sport-Weste-Top.jpg,5.4,28
1005003568220496,Frauen Neue Mode Kleidung Sexy Sleeveless Strass Bustier Push-Up Night Club Bralette Bh Cropped Top Weste Korsett,https://ae01.alicdn.com/kf/H7387578c7f2a4459848bad83b3f2f3b85/Frauen-Neue-Mode-Kleidung-Sexy-Sleeveless-Strass-Bustier-Push-Up-Night-Club-Bralette-Bh-Cropped-Top.jpg,37.41,396
1005005302937292,Frauen Einfarbig Casual Langarm Crop Tops Sweatshirt Pullover Pullover,https://ae01.alicdn.com/kf/Sa3774d84d562486b8ce446642dabcab4v/Frauen-Einfarbig-Casual-Langarm-Crop-Tops-Sweatshirt-Pullover-Pullover.jpg,15.92,7984
1005005240754178,Sexy Frauen Leibchen Rohr Tops Fix Tasse Nahtlose Schönheit Zurück Unterwäsche Sport Crop T Dessous Camis Tank Bralette Soutien Wasserschutzprojekt Drei-schluchten-staudamm,https://ae01.alicdn.com/kf/S428ddce35b4a4ded9c3013df9c141c12C/Sexy-Frauen-Leibchen-Rohr-Tops-Fix-Tasse-Nahtlose-Sch-nheit-Zur-ck-Unterw-sche-Sport-Crop.jpg,18.77,8
1005005325130228,Frauen Top Shirt einfarbig Slim Fit Schlinge niedrige Brust Tank Top Sommer Ernte heißen Pullover wilde Mode Outfit,https://ae01.alicdn.com/kf/Sad3a46c179c1441d8cbd45b8d41603ceQ/Frauen-Top-Shirt-einfarbig-Slim-Fit-Schlinge-niedrige-Brust-Tank-Top-Sommer-Ernte-hei-en-Pullover.png,6.07,201
1005005885543672,Frauen unregelmäßige lange Hemden weiße Bluse Sommer Herbst Turn-Down Kragen Tasche Langarm einreihige Hemd Tops und Bluse,https://ae01.alicdn.com/kf/S5fd7a68d77c348d6b11ddfb08f3a38859/Frauen-unregelm-ige-lange-Hemden-wei-e-Bluse-Sommer-Herbst-Turn-Down-Kragen-Tasche-Langarm-einreihige.jpg,13.1,11954
1005006190366768,Off Shoulder Bustier Tube Top träger losen Bodysuit Frauen Tangas Shape wear Bauch Kontrolle Body Shaper Taille Trainer dünne Unterwäsche,https://ae01.alicdn.com/kf/S1b8d1497dbf74626902f202f61400f48H/Off-Shoulder-Bustier-Tube-Top-tr-ger-losen-Bodysuit-Frauen-Tangas-Shape-wear-Bauch-Kontrolle-Body.jpg,5.12,1591
1005005963198193,Yellowstone T-Shirt Frauen japanische Top weibliche Anime Designer Harajuku Kleidung,https://ae01.alicdn.com/kf/Scf4ce7c095034dd5b5fbf9699211a1dfT/Yellowstone-T-Shirt-Frauen-japanische-Top-weibliche-Anime-Designer-Harajuku-Kleidung.jpg,9.37,52766
1005006375710768,Vintage Plaid Shirts Frauen Herbst Langarm Overs ize Button Up Shirt koreanische Mode lässig Herbst Outwear Tops Blusas Mujer,https://ae01.alicdn.com/kf/Hdafd9df3e1214755970b743e092305430/Vintage-Plaid-Shirts-Frauen-Herbst-Langarm-Overs-ize-Button-Up-Shirt-koreanische-Mode-l-ssig-Herbst.jpg,18.96,3598
1005005561266740,Atmungsaktive sexy nahtlose Top Frauen Sport-BH hohe Wirkung für Fitness Fitness Yoga Sportswear Push-up-BH untere Weste mit Brust polster,https://ae01.alicdn.com/kf/S05f98db8c0144f15a842002677ebc3f6N/Atmungsaktive-sexy-nahtlose-Top-Frauen-Sport-BH-hohe-Wirkung-f-r-Fitness-Fitness-Yoga-Sportswear-Push.jpg,5.59,3541
1005005455052498,2023 Harajuku Diamanten Perlen Katze Bogen Stickerei Pullover Frauen Rüschen Blume Jacquard Cartoon Pullover Pullover Crop Tops,https://ae01.alicdn.com/kf/S0552320a64724f6686ccfe20ed10a51az/2023-Harajuku-Diamanten-Perlen-Katze-Bogen-Stickerei-Pullover-Frauen-R-schen-Blume-Jacquard-Cartoon-Pullover-Pullover.jpg,28.06,934
1005006447971713,Knopf dekor gerafftes T-Shirt lässiges Langarm-Top für Damen bekleidung im Frühling und Herbst,https://ae01.alicdn.com/kf/Se1e4cbc115d9403f9f91f462c6a36b44d/Knopf-dekor-gerafftes-T-Shirt-l-ssiges-Langarm-Top-f-r-Damen-bekleidung-im-Fr-hling.jpg,16.96,1665
1005006315824287,Damen Weste Qualität gestrickt Camis U-Ausschnitt ärmellose Tanktops lässig einfarbig Basic Leibchen für Frauen,https://ae01.alicdn.com/kf/S7855424cf95f433e9551369089dbfd2au/Damen-Weste-Qualit-t-gestrickt-Camis-U-Ausschnitt-rmellose-Tanktops-l-ssig-einfarbig-Basic-Leibchen-f.jpg,7.07,17992
32911113104,Heißer Verkauf 3 stücke/100% Baumwolle Herren Ärmellose Tank Top Solide Muscle Weste Unterhemden Oansatz Gymclothing Tees Quirl Tops,https://ae01.alicdn.com/kf/S0cb7f7f18878411285ccc8232c9e5549d/Hei-er-Verkauf-3-st-cke-100-Baumwolle-Herren-rmellose-Tank-Top-Solide-Muscle-Weste-Unterhemden.jpg,21.07,71537
1005001776489527,Brauchen Neue Hasser Brief Drucken T Shirt Frauen Kurzarm O Neck Lose T-shirt Sommer Frauen T Shirt Tops Camisetas mujer,https://ae01.alicdn.com/kf/Sb4583596424e4f639323a17976794cb25/Brauchen-Neue-Hasser-Brief-Drucken-T-Shirt-Frauen-Kurzarm-O-Neck-Lose-T-shirt-Sommer-Frauen.jpg,2.98,31338
1005005450390613,Einteilige nahtlose Crop Top Damen Unterwäsche Draht freie U-förmige Leibchen breite Träger gestreifte feste Bra lette Dessous Tube Tops,https://ae01.alicdn.com/kf/S99d9cbc033014f30875a9032d38159bbU/Einteilige-nahtlose-Crop-Top-Damen-Unterw-sche-Draht-freie-U-f-rmige-Leibchen-breite-Tr-ger.jpg,7.91,59737
1005006052301902,Frauen tanzen Tops Farbe Spleiß gestrickt Top gefälschte zweiteilige Strickwaren klassische lange Ärmel Tanz kostüme,https://ae01.alicdn.com/kf/Scd681087176a489db09f85c43da5c57f1/Frauen-tanzen-Tops-Farbe-Splei-gestrickt-Top-gef-lschte-zweiteilige-Strickwaren-klassische-lange-rmel-Tanz-kost.jpg,15.13,1491
1005005310620368,Grundlegende Tank Top Frauen Ärmellose Tops Casual Sommer Mode Split Camis Leibchen Geraffte Schwarz Tanks Westen Sexy Crop Top Kleidung,https://ae01.alicdn.com/kf/S2cb19ad853e643ba90b1f3c6500b9467x/Grundlegende-Tank-Top-Frauen-rmellose-Tops-Casual-Sommer-Mode-Split-Camis-Leibchen-Geraffte-Schwarz-Tanks-Westen.jpg,19.88,11930
1005005625484034,Deeptown Kawaii Lolita Blusen weiße Frauen süße Spitze Tops Rüschen hemden Vintage Puff ärmel japanische adrette Stil süße Tops,https://ae01.alicdn.com/kf/Sbe4e3baf368243989c9b78fa37f76ea8q/Deeptown-Kawaii-Lolita-Blusen-wei-e-Frauen-s-e-Spitze-Tops-R-schen-hemden-Vintage-Puff.jpg,21.04,3863
1005003527701390,Neue Sexy Club Solide Strick Pullover Casual Frühling und Herbst Schlank Vintage Top Frauen V Neck Straße Stil Lange Ärmeln pullover,https://ae01.alicdn.com/kf/Hc51f31982e7043919f5acbaea4d56c42f/Neue-Sexy-Club-Solide-Strick-Pullover-Casual-Fr-hling-und-Herbst-Schlank-Vintage-Top-Frauen-V.jpg,25.59,12075
1005005921293873,Schulter freie Bandage Bluse Frauen Puff Langarm Patchwork Slash Neck Plissee sexy Tops weiblich Frühling Sommer elegant,https://ae01.alicdn.com/kf/S9ee2eefd1fb44ab4a259db1fe467bb78d/Schulter-freie-Bandage-Bluse-Frauen-Puff-Langarm-Patchwork-Slash-Neck-Plissee-sexy-Tops-weiblich-Fr-hling.jpg,15.79,40
1005002313082192,Einfarbig Sexy Mode Sport Bhs Atmungsaktive Wirefree Padded Push Up Sport Top Fitness Gym Yoga Workout Bh Sport-Bh top,https://ae01.alicdn.com/kf/H01f3825caa434cc599c1660b079b041fv/Einfarbig-Sexy-Mode-Sport-Bhs-Atmungsaktive-Wirefree-Padded-Push-Up-Sport-Top-Fitness-Gym-Yoga-Workout.jpg,18.27,279874
1005006117691850,Frauen Crop Top sexy BH nahtlose Tanktops Sommer weibliche weiße Riemen Top rücken freie Leibchen solide kurze Camis Kleidung,https://ae01.alicdn.com/kf/Sbd069f9576ad4390bbb8f71cec29624cb/Frauen-Crop-Top-sexy-BH-nahtlose-Tanktops-Sommer-weibliche-wei-e-Riemen-Top-r-cken-freie.jpg,5.13,163
1005005953031011,Lovejoy top frauen manga japanische y2k tee weibliche manga kleidung,https://ae01.alicdn.com/kf/Sed450680319941188e74de60ed27e319y/Lovejoy-top-frauen-manga-japanische-y2k-tee-weibliche-manga-kleidung.jpg,8.77,29939
1005006000315725,Xpqbb koreanische schicke kurze Kapuzen-Strickjacken Frauen Herbst Winter aushöhlen Reiß verschluss Strick pullover Mantel lässig lose Strick oberteile,https://ae01.alicdn.com/kf/S6640ead120b841a4985ac17a57dae6f2i/Xpqbb-koreanische-schicke-kurze-Kapuzen-Strickjacken-Frauen-Herbst-Winter-aush-hlen-Rei-verschluss-Strick-pullover-Mantel.jpg,23.27,3512
1005006033694082,Übergroße Pullover lose y2k Pullover ästhetische Streetwear Pullover Unisex Pullover Frauen ins warme Anime Winter Casual Top,https://ae01.alicdn.com/kf/S95448f3199fb44fe88c0313e7070fe20H/bergro-e-Pullover-lose-y2k-Pullover-sthetische-Streetwear-Pullover-Unisex-Pullover-Frauen-ins-warme-Anime.jpg,43.23,232
1005006109853191,Einfarbiger quadratischer Kragen Neck holder Hals Frauen Fitness Sport BH Sport Fitness studio Yoga Brust polster umfassendes Training Joggen sexy Rücken,https://ae01.alicdn.com/kf/Sa51c996c34d84dc28dc8b0598b1f5e83r/Einfarbiger-quadratischer-Kragen-Neck-holder-Hals-Frauen-Fitness-Sport-BH-Sport-Fitness-studio-Yoga-Brust-polster.jpg,24.29,19968
1005005471253916,Sommer Retro süße Plaid Muster Strick Leibchen Baumwolle sexy schlanke Frauen Bottom ing Crop Top,https://ae01.alicdn.com/kf/S78317db5a12141f6aaba789380f0febaR/Sommer-Retro-s-e-Plaid-Muster-Strick-Leibchen-Baumwolle-sexy-schlanke-Frauen-Bottom-ing-Crop-Top.jpg,7.21,30
1005004640318607,ICH Unterbrechen Mein Spiel zu Werden Hier vintage Lustige T Shirt Gamer Gaming Player Humor Tees Tops für Männer Kleidung casual grafik t shirts,https://ae01.alicdn.com/kf/S7a400711be66483c81afee11e9e12096W/ICH-Unterbrechen-Mein-Spiel-zu-Werden-Hier-vintage-Lustige-T-Shirt-Gamer-Gaming-Player-Humor-Tees.jpg,14.26,220218
1005006036628826,"Damen-Strickpullover mit langen Ärmeln, verkürzter Bolero-Cardigan-Pullover und kurzem Schal-Oberteil",https://ae01.alicdn.com/kf/Sf27839acd36643538088b92aa93019c5x/Damen-Strickpullover-mit-langen-rmeln-verk-rzter-Bolero-Cardigan-Pullover-und-kurzem-Schal-Oberteil.jpg,13.13,3989
1005006053853369,Y2k koreanische Mode Streetwear Frauen übergroße Streetwear Frauen ästhetischen Gothic Print Hoodie Paar Sweatshirts Hoodie Tops,https://ae01.alicdn.com/kf/S573cde74aa20446586f68aa06aaaa20a7/Y2k-koreanische-Mode-Streetwear-Frauen-bergro-e-Streetwear-Frauen-sthetischen-Gothic-Print-Hoodie-Paar-Sweatshirts-Hoodie.jpg,27.36,24837
1005006095244830,Herbst und Winter nahtlose deutsche Samt Thermo Weste für Frauen fest integrierte Brust polster Boden Thermo Unterwäsche für Frauen,https://ae01.alicdn.com/kf/S751046a7e5774149bec158a7f4eaf796G/Herbst-und-Winter-nahtlose-deutsche-Samt-Thermo-Weste-f-r-Frauen-fest-integrierte-Brust-polster-Boden.jpg,10.87,3359
1005006018407430,Kimotimo süße Stickerei Strickjacke Pullover Frauen Herbst Winter Vintage Rundhals ausschnitt Schnürung Kontrast gestrickt Top Mode Y2k Mantel,https://ae01.alicdn.com/kf/S1e66b7c097b94b2a93f48d74b3f09d356/Kimotimo-s-e-Stickerei-Strickjacke-Pullover-Frauen-Herbst-Winter-Vintage-Rundhals-ausschnitt-Schn-rung-Kontrast-gestrickt.jpg,29.03,99989
1005002793038890,Shrugs Frauen Solide Elegante Atmungs Sonne Schattierung Bolero Freizeit Strickjacken Koreanischen Stil Weibliche Alle-spiel Schal Mujer Chic Tops,https://ae01.alicdn.com/kf/Hf2d03e80d1ea4d56820efdc9acfbd586J/Shrugs-Frauen-Solide-Elegante-Atmungs-Sonne-Schattierung-Bolero-Freizeit-Strickjacken-Koreanischen-Stil-Weibliche-Alle-spiel-Schal.jpg,7.88,22301
1005005672924666,100% Baumwolle Herren übergroße T-Shirt ärmellose Tank Top einfarbige Fitness Männer Muskel westen Bodybuilding T-Shirt für Männer T-Shirts,https://ae01.alicdn.com/kf/S6d89bc0d9389462eb38e7bc850109298v/100-Baumwolle-Herren-bergro-e-T-Shirt-rmellose-Tank-Top-einfarbige-Fitness-M-nner-Muskel-westen.jpg,7.43,319104
1005005590658965,[Du bist mein Geheimnis] Halloween aushöhlen Frauen Tanktops Streetwear Schädel Muster Tops drucken Gothic Rose Weste ärmellose Fitness,https://ae01.alicdn.com/kf/S8f9f7a45393540a6b9b7e923731f4b388/Du-bist-mein-Geheimnis-Halloween-aush-hlen-Frauen-Tanktops-Streetwear-Sch-del-Muster-Tops-drucken.jpg,11.56,1244
1005005733267065,Einfarbige Strumpfhosen u Form Frauen sexy Fitness Sport BH engen Fitness studio Yoga Top Gym Cross Back Schulter gurt abnehmbare Brust polster,https://ae01.alicdn.com/kf/Sc5a71bb3ed5f4d79bdaed05e77300c6fa/Einfarbige-Strumpfhosen-u-Form-Frauen-sexy-Fitness-Sport-BH-engen-Fitness-studio-Yoga-Top-Gym-Cross.jpg,19.53,23786
